{
  "$schema": "https://raw.githubusercontent.com/crine-in/all-religious-texts/main/schemas/verse.schema.json",
  "id": "religion:collection:book:1.1.1",
  "externalId": 1,
  "religion": "Religion Name",
  "collection": "Collection Name",
  "book": "Book Title",
  "canto": null,
  "chapter": 1,
  "section": 1,
  "verse": 1,
  "subVerse": null,
  "citation": "1.1.1",
  "language": "Sanskrit",
  "script": "IAST",
  "text": "Complete verse text goes here.",
  "license": "Public Domain",
  "source": "Source Digital Archive Name",
  "attribution": "Attribution notice",
  "translator": null,
  "edition": "Standard Edition",
  "footnotes": [],
  "crossReferences": [],
  "keywords": ["wisdom", "truth"],
  "checksum": "e3b0c44298fc1c149afbf4c8996fb92427ae41e4649b934ca495991b7852b855",
  "lastUpdated": "2026-07-23T00:00:00Z"
}
